Имя документа,Автор,Название работы,Год издания,Объем (в словах)
Shklovsky_Iskusstvo,В.Б. Шкловский,"Искусство как приём; О ритмико-мелодических опытах проф. Сиверса; Литература вне «сюжета»","1917; 1917; 1921",9966
Shklovsky_Potebnya,В.Б. Шкловский,"Потебня; Связь приёмов сюжетосложения с общими приёмами стиля; О поэзии и заумном языке","1919; 1919; 1919",10854
Eikhenbaum_KakSdelana,Б.М. Эйхенбаум,"Как сделана «Шинель» Гоголя",1919,9056
Eikhenbaum_OGenri,Б.М. Эйхенбаум,"О. Генри и теория новеллы",1925,9361
Tynyanov_Dostoevski,Ю.Н. Тынянов,"Достоевский и Гоголь (к теории пародии); Пушкин и Тютчев","1921; 1926",11325
Tynyanov_Problema,Ю.Н. Тынянов,"Проблема стихотворного языка",1924,21442
Zhirmunsky_Kompozicija,В.М. Жирмунский,"Композиция лирических стихотворений",1919,23240
Zhirmunsky_Zadachi,В.М. Жирмунский,"Задачи поэтики; Мелодика стиха","1921; 1922",15629
